authors,year,title,journal,abstract
D Paderta,2012,Open Data-Raumbezogene Daten,D Paderta - 2012 - ssoar.info,"Open Data besitzen auf nationaler und internationaler Ebene eine hohe politische Relevanz. 
Die seit Jahrzehnten geführte Diskussion um die Öffnung von amtlichen Geodaten erhält …"
L Spitzer,,Open Science,pada.psycharchives.org,Open Science … Open Data Open Material … Beispiel für den Bereich Open Science: Open Science Knowledge Base …
F Lohmeier,2016,10 Schritte für mehr Openness in Ihrer Bibliothek,13. InetBib-Tagung vom 10. bis 12. Februar in …,"… Dieses Prinzip erlebt in der digitalen Welt mit Open Access, Open Source und Open Data seit 
… Openness vorgestellt, die interessierte Bibliotheken als Checkliste für sich nutzen können. …"
Z Sona,2021,Geisteswissenschaftliche Citizen Science-Projekte mit Open Data-Ansatz in deutschen Gedächtnisinstitutionen,Z Sona - 2021 - edoc.hu-berlin.de,"… Die vorliegende Arbeit geht der Frage nach, welche Erfahrungen Gedächtnisinstitutionen 
in geisteswissenschaftlichen Citizen Science-Projekten mit Open Data-Ansatz machen und …"
"H Pampel, LM Ferguson, S Druskat, U Konrad",2023,3. Helmholtz Open Science Forum Forschungssoftware. Helmholtz Open Science Briefing,"H Pampel, LM Ferguson, S Druskat, U Konrad… - 2023 - gfzpublic.gfz-potsdam.de","… Damals wurde ua in parallelen Sessions die Grundlage für eine Checkliste zum Thema 
geschaffen, die Ende 2021 veröffentlicht wurde und die Zentren bei der Policyentwicklung zum …"
R Sturm,2023,Visualisierung von Open Data,R Sturm - 2023 - edoc.hu-berlin.de,"… Daher ist es wichtig, dass Open Data Portale über solche Werkzeuge verfügen und diese 
für … Es zeigt sich, dass sich die Erkenntnisse der Umfrage mit zuvor beschriebenen …"
"A Berg-Weiß, S Hermann, M Kötter, C Lei",2022,Openness in Bibliotheken: Positionspapier der Kommission für forschungsnahe Dienste des VDB,o-bib. Das offene …,"… 1 Das Positionspapier wurde von der Kommission für forschungsnahe Dienste des VDB – 
Verein Deutscher Bibliothe… Offene Wissenschaft ist Teil der guten wissenschaftlichen Praxis. …"
M Kammermann,,Linked Open Data in Recommender Systems,digitale-nachhaltigkeit.unibe.ch,"… Die Empfehlung für Produkte ist vergleichsweise einfach. Nur die beliebtesten Artikel werden 
ausgestellt, etwa die Blockbuster in einer Videothek. Im Gegensatz dazu bieten Streaming …"
"P Christoph, A Pohl",2014,"Dezentral, offen, vernetzt–Überlegungen zum Aufbau eines LOD-basierten FID-Fachinformationssystems",Bibliothek Forschung und Praxis,"… Während Open Data keine Datenformate vorgibt, solange es sich um offen dokumentierte 
Formate handelt, geht es bei Linked Data um die Etablierung von Best Practices für die …"
NMG der Bayerischen,2012,Verbundkatalog B3Kat als Linked/Open Data freigegeben,Zeitschrift: ABI-Technik Heft,"… im Format MARC-XML (http://www.bib-bvb.de/open-data. html) und als Linked … Das 
Angebot ist ua über das Open-Data-Portal des Freistaats Bayern erreichbar: http://opendata.bayern.…"
A Pohl,2011,Open Data im hbz-Verbund,A Pohl - 2011 - hbz.opus.hbz-nrw.de,"… Für diesen Leitfaden ist Input erwünscht: Es geht darum, konkrete rechtliche Fragen und 
Probleme zu beleuchten, die die Freigabe eines Bibliotheks- oder Verbundkatalogs mit sich …"
"C Heise, C Herzog",,OPEN DATA UND INVESTIGATIVER JOURNALISMUS,researchgate.net,"… Open-Data Projekten ein Nischendasein fristen — Kaum bekannten Beispiele für ausschließlich 
auf Open Data-Projekten der öffentlichen Hand beruhenden Investigativjournalismus …"
E Pellin,2023,Offene Wissenschaft mit CC-Lizenzen. Wissenschaftliches Publizieren,E Pellin - 2023 - boris.unibe.ch,"Mit der gewählten Lizenz bestimmen die Urheber*innen, wie ihr Werk nachgenutzt werden 
kann. Die Lizenz gilt, solange ein Werk urheberrechtlich geschützt ist. Mit einer möglichst …"
"R Messerschmidt, AC Schrader",2021,Offene Forschungssoftware als integraler Bestandteil von Open Science und guter wissenschaftlicher Praxis,"R Messerschmidt, AC Schrader - 2021 - gfzpublic.gfz-potsdam.de","… ● dazu beginnt nun ein weitergehender Austauschprozess, in dem alle Helmholtz-Akteure 
herzlich willkommen sind, sich aktiv an der kollaborativen Erarbeitung einer Checkliste zur …"
A Kasprzik,2017,Projektvorhaben TEASER-Entwicklung einer Plattform für die kollaborative Thesauruspflege und-verknüpfung am Beispiel „Industrie 4.0 “,Workshop 1. SI & IT der VZG (Projekt coli-conc) …,"… vor • Eine Vernetzung mit anderen Vokabularen bleibt für kleinere und weniger technikaffine 
Informationseinrichtungen eine Herausforderung • Im Zeitalter von Linked Open Data und …"
M Rathmanner,2015,"Workshop Open Access und Open Data in Horizon 2020-Rechtliche Vorgaben und praktische Umsetzung (Wien, 11. Juni 2015)",Mitteilungen der Vereinigung Osterreichischer …,"… an Koordination und Kooperation der wichtigen Player (Bibliotheken, IT-Service, 
Forschungsfördereinrichtungen und Wissenschaftler) zur Umsetzung von Open Access und Open …"
"F Ostrowski, A Pohl",2013,Zur Entwicklung eines Linked-Open-Data-Dienstes für Bibliotheksdaten,"Vernetztes Wissen–Daten, Menschen …","… Als “Linked Open Data” bezeichnen wir publizierte Daten, wenn sie zusätzlich zu den 
genannten Anforderungen Open Knowledge Foundation, 2009 entsprechen. Für mehr …"
K Matuszkiewicz,2022,"Eine Frage der Einstellung. Von Daten, Dokumenten, Repositorien, Fächern und Menschen im Zuge der digitalen Transformation",K Matuszkiewicz - 2022 - opus4.kobv.de,"… Linked Open Data besonders offen gegenüberstehen, hat nicht nur etwas mit dem 
Vorhandensein der benötigten Hard- und Software zu tun, sondern ist auch eine Frage der …"
C Goldberger,2020,"Open Data-Auswirkung auf die Entwicklung neuer Geschäftsideen/eingereicht von Christian Goldberger, BSc",C Goldberger - 2020 - epub.jku.at,"… on open data and its impact on new business ideas and models. It examines which open data … Wie aus den drei Leitfaden ersichtlich, versucht man die bestmögliche Qualität und den …"
"HD Loenneker, JF Huber, C Artemenko",2022,Realitätscheck Open Science in der universitären Lehre,Psychologische …,"… In spezifischen Seminaren zu Open Science kann theoretisches und praktisches Wissen 
hierzu vermittelt werden. Wir haben sehr gute Erfahrungen mit der Reflektion von Studien …"
J Schirrwagen,2017,Open Science-Ansätze und Perspektiven für die Universitätsbibliothek,Kolloquium Wissensinfrastruktur,"… “Open Science is the practice of science in such a way that others can collaborate and 
contribute, where research data, lab notes and other research processes are freely available, …"
LM Anterhaus,2020,Inhaltliche Konzeption des Open Data-Portals beim Landkreis Osnabrück,LM Anterhaus - 2020 - opus.hs-osnabrueck.de,"… -Portale vertraut gemacht haben, wird empfohlen einen Leitfaden über Open Data und 
die einzelnen Schritte und Ziele zu erstellen, um eine Struktur und Leitlinie für den …"
"M Putnings, K Söllner",2022,Erste Open Science Policy an einer Universität in Deutschland: Grundsätze zur Umsetzung von Open Science an der Friedrich-Alexander-Universität …,o-bib. Das offene Bibliotheksjournal/Herausgeber …,"… Externe Open-Science-Policies konnten nur bedingt als Muster herangezogen werden. 
Anfang Februar 2021 waren über Internetrecherchen im deutschsprachigen Raum nur das …"
"EFPDG Buchholz, ZFM Kenning",,Inhaltliche Konzeption des Open Data-Portals beim Landkreis Osnabrück,opus.hs-osnabrueck.de,"… -Portale vertraut gemacht haben, wird empfohlen einen Leitfaden über Open Data und 
die einzelnen Schritte und Ziele zu erstellen, um eine Struktur und Leitlinie für den …"
