authors,year,title,journal,abstract
"T Kreutzer, H Lahmann",2021,Rechtsfragen bei Open Science: Ein Leitfaden,"T Kreutzer, H Lahmann - 2021 - library.oapen.org","Digitisation enables open science. Digitisation has many aspects, in particular free access 
to scholarly publications and materials (Open Access), transparent review procedures (Open …"
"M Bühner, AL Schubert, C Bermeitinger",2022,"Kommentare zum Positionspapier Brachem, J. et al.(2022). Replikationskrise, p-hacking und Open Science. Eine Umfrage zu fragwürdigen Forschungspraktiken in …",Psychologische …,"Der Vorstand der Deutschen Gesellschaft für Psychologie (DGPs) hat sich sehr über die 
vorliegende empirische Studie der PsyFaKo zur Frage der Forschungsqualität in studentischen …"
"J Brachem, M Frank, T Kvetnaya",2022,"Replikationskrise, p-hacking und Open Science",Psychologische …,"… In der Konsequenz ist ein interessanter methodischer Aspekt unserer Umfrage, dass wir 
uns dem Anteil der von einer QRP tatsächlich betroffenen Projekte in unserer Stichprobe …"
EE der Handlungsempfehlungen,2022,Extracurriculare Open Science,Psychologische Rundschau,"… das Positionspapier um wertvolle extracurriculare Möglichkeiten der Open Science-Vermittlung … 
Damit sind solche Möglichkeiten der Open Science-Vermittlung gerade, aber nicht …"
K Söllner,2020,"Till Kreutzer, Henning Lahmann: Rechtsfragen bei Open Science: ein Leitfaden. Hamburg: Hamburg University Press, 2019.–156 S., 1 Abb.–ISBN 978-3-943423-66-2 …",K Söllner - 2020 - degruyter.com,"… dem Leitfaden eine häufig aktualisierte Neuauflage zu wünschen ist. Der Leitfaden von … 
im Open-Science-Kontext immer häufiger gefragt ist, zumindest in kleinen Teilen zu stillen. …"
"M Frank, LFF Schramm, L Volz",2022,Open Science in der Lehre–ein Kulturwandel mit systemimmanenten Hürden,Psychologische …,"… , dass unsere Umfrage eher Studierende attrahiert, die sich für Open Science und Methodik 
… Nachdem die Auswertung der Umfrage in erster Linie deskriptiv und explorativ durchgeführt …"
"T Rosman, T Burgard, M Bosnjak",2022,Die Open Science-Infrastruktur in der deutschsprachigen Psychologie: Ergebnisse der ZPID-Nutzerstudie 2021,ZPID Science Information …,… Im Zuge des Kulturwandels hin zu Open Science werden in … Informationen zu den Open Science-Infrastrukturbedarfen der … deutschsprachigen Ländern; die Umfrage richtete sich aber …
D Grüning,2022,Extracurriculare Open Science. Eine Ergänzung der Handlungsempfehlungen,Psychologische Rundschau,"… das Positionspapier um wertvolle extracurriculare Möglichkeiten der Open Science-Vermittlung … 
Damit sind solche Möglichkeiten der Open Science-Vermittlung gerade, aber nicht …"
T Kreutzer,2011,Open Data–Freigabe von Daten aus Bibliothekskatalogen,T Kreutzer - 2011 - hbz.opus.hbz-nrw.de,"… und was das für die Realisierbarkeit von Open Data im Einzelnen bedeutet. Darüber 
hinaus … der „Open-DataLizenz“ in den Vordergrund. Der vorliegende Leitfaden soll eine …"
S Imeri,2017,Open Data? Zum Umgang mit Forschungsdaten in den ethnologischen Fächern,S Imeri - 2017 - edoc.hu-berlin.de,"… positive Grundhaltung gegenüber Datenarchivierung und -nachnutzung genauso wie die 
Bereitschaft, sich mit dem Thema weiter zu befassen: Rund 65 % derjenigen, die die Umfrage …"
DJ Grüning,2021,Extracurriculare Open Science: Eine Ergänzung der Handlungsempfehlungen,DJ Grüning - 2021 - scholar.archive.org,"… das Positionspapier um wertvolle extracurriculare Möglichkeiten der Open Science-Vermittlung … 
Damit sind solche Möglichkeiten der Open Science-Vermittlung gerade, aber nicht …"
"M Kloe, C Niessner, A Woll, K Bös",2019,Open data im sportwissenschaftlichen anwendungsfeld motorischer tests,German Journal of Exercise and Sport …,"… In summary, open data enjoys high acceptance and approval in the … Umfrage zeigt sich ein 
sehr hohes gesellschaftlich-öffentliches als auch wissenschaftliches Potential von Open Data …"
"T Lonsdorf, G Hartwigsen, A Kübler",2022,Fachgruppe Biologische Psychologie und Neuropsychologie. Mehr als nur fragwürdig: Reproduzierbarkeit und Open Science in der Lehre aus Sicht der …,Psychologische …,In den letzten Jahren konnte eine zunehmend intensivere Auseinandersetzung mit „Open Science “und „Replizierbarkeit “in der psychologischen Forschung beobachtet werden. Eine …
"M Lee, C Wagner",2021,Open Science Conference 2021,ABI Technik,"… Themen rund um das Handlungsfeld Open Science (OS): von einem studentisch betriebenen 
Journal über Data Communities bis zur UNESCO-Empfehlung zu Open Science. [2] Alle …"
"S Nebe, A Hermann, MJ Herrmann",2022,… und ihre Anwendung eV (DGPA). Das Potential der biopsychologischen und neurowissenschaftlichen Lehre zur Vermittlung von Open Science Praktiken,Psychologische …,"… Auf diese Weise können wir den Studierenden die Bedeutung von Open Science Praktiken 
für den … Fächern besonders zur Vermittlung des Werts von Open Science Praktiken. …"
"G Sproesser, LM König, J Strahler",2022,Fachgruppe Gesundheitspsychologie. Open Science und gute wissenschaftliche Praxis in der gesundheitspsychologischen Lehre,Psychologische …,"… Open Science und Transparenz sind prominente Themen in der Gesundheitspsychologie, 
wie nicht zuletzt durch das Positionspapier zu offener und transparenter …"
"N Barnickel, J Klessmann",2012,Open Data-Am Beispielvon Informationen des öffentlichen Sektors,… : Offenheit in der digitalen Welt und …,"… In dieser Empfehlung werden zum einen ausgewählte Open-Data-Prinzipien für die lokalen 
Gegebenheiten interpretiert und zum anderen eigene Anliegen formuliert. In dem Dokument …"
"A Pohl, P Danowski",2013,Linked Open Data in der Bibliothekswelt: Grundlagen und Überblick,(Open) Linked Data in Bibliotheken,"… Werden Bibliotheksdaten im Web als Linked Open Data angeboten, können automatisch … 
Hier kommt das „Open “in Linked Open Data ins Spiel, das eben sicherstellt, dass die Daten …"
"LM Ferguson, R Bertelmann, C Bruch",2021,Helmholtz Open Science Briefing: Gute (digitale) wissenschaftliche Praxis und Open Science: Support und Best Practices zur Umsetzung des DFG-Kodex „Leitlinien …,"LM Ferguson, R Bertelmann, C Bruch… - 2021 - gfzpublic.gfz-potsdam.de","… und Open Science” des Helmholtz Open Science Office legt den Fokus auf die für Open Science 
… soll als Impuls und Orientierung dienen, Open Science bei der Einführung des Kodex in …"
"A Braun, P Nguyen, D Frie",2022,Open-was…!? Einstellungen zu Open Data und Open Government am Niederrhein,"A Braun, P Nguyen, D Frieß - 2022 - diid.hhu.de","… Neben den persönlichen Erfahrungen mit Open Data fragte die Umfrage auch nach der 
allgemeinen Situation innerhalb der Verwaltungen. Dabei ging es etwa darum, Zuständigkeiten …"
"R Messerschmidt, H Pampel, F Bach, W zu Castell",2021,Checkliste zur Unterstützung der Helmholtz-Zentren bei der Implementierung von Richtlinien für nachhaltige Forschungssoftware,"R Messerschmidt, H Pampel, F Bach, W zu Castell… - 2021 - gfzpublic.gfz-potsdam.de","… Helmholtz-Gemeinschaft wurde eine Muster-Richtlinie für den nachhaltigen Umgang mit 
Forschungssoftware an den Helmholtz-Zentren6 erarbeitet, die vom Arbeitskreis Open Science …"
M Binzen,2021,Using Open Data Effectively–Basics and Backgrounds,HMD Praxis der Wirtschaftsinformatik,"… durch offene Daten und wie kann man damit umgehen? Der Bitkom beschäftigt sich schon 
länger mit diesen Fragen und hat dazu 2017 einen Arbeitskreis Open Data… Offene Daten nach …"
"M Gollwitzer, CH Antoni",2022,DGPs-Kommission „Studium und Lehre “der DGPs. Die Lehre von heute ist die Forschung von morgen,Psychologische …,"… Die außerordentlich hohe Relevanz, die den Themen „Open Science “und Replizierbarkeit 
eingeräumt wird (s. Abb. 4 im Target-Artikel), zeigt, dass Studierende für diese wichtigen …"
"T Lonsdorf, G Hartwigsen, A Kübler, C Merz",2022,Mehr als nur fragwürdig: Reproduzierbarkeit und Open Science in der Lehre aus Sicht der Biologischen Psychologie und Neuropsychologie,Psychologische …,… In den letzten Jahren konnte eine zunehmend intensivere Auseinandersetzung mit „Open Science“ und „Replizierbarkeit“ in der psychologischen Forschung beobachtet werden. Eine …
"M Duine, F Harnisch",2022,"9. Internationale Open Science Conference: Online-Konferenz, 8. bis 10. März 2022",ABI Technik,"… Zunächst fasste Vera Lacoeuilhe (Permanent Delegation of Saint Lucia to UNESCO) 
zusammen, wie die Empfehlung entstanden war. Sie erläuterte den herausfordernden …"
C Wiljes,2018,Open Science als Thema in Lehre und Fortbildung,Kolloquium Wissensinfrastruktur,"… ► Open Access (OA): wissenschaftliche Literatur soll für alle Nutzerinnen und Nutzer 
kostenlos zugänglich sein ► Open Data: Forschungsdaten sollen so weit wie rechtlich möglich …"
"L Bieker, L Bruns, BEP Thapa, C Welzel",2019,Open Data zwischen Wunsch und Wirklichkeit,"L Bieker, L Bruns, BEP Thapa, C Welzel - 2019 - publica.fraunhofer.de","… Un terschiede in der Umsetzung von Open Data heraus, sondern gehen auch … Open-Data-Ökosysteme 
entstehen und welche Faktoren für eine erfolgreiche Umsetzung von Open Data …"
"M Binzen, M Kleemann",2019,Hackathons mit Nutzung von Open Data–der Wert von frei zugänglichen Daten,ZfV-Zeitschrift für Geodäsie …,"… Unsere dringende Empfehlung ist es daher, selbst an einem Hackathon teilzunehmen. 
Ersatzweise kann man die in den Quellen empfohlenen diversen YouTube-Videos, die während …"
G Meßmer,2012,Bibliographische Daten für alle frei zugänglich machen: der gemeinsame Verbundkatalog B3Kat als Linked Open Data,G Meßmer - 2012 - opus4.kobv.de,"… als Open Data im MARCxml-Format und als Linked Open Data freigestellt. Der Vortrag 
stellt den Wert offener Katalogdaten und die zwei Teilprojekte des B3Kat-LoD-Projekts dar. …"
JM Toplak,2010,Open Science und Informationsethik,JM Toplak - 2010 - opus4.kobv.de,"… Zudem wird ein Leitfaden für den Umgang mit ethisch fraglichen wissenschaftlichen Daten … 
Dabei soll vor allem ein Leitfaden im Umgang mit ethisch brisanten wissenschaftlichen Daten …"
"EK zu Chancen, HB offener Daten",,Open Data in Kommunen,difu.de,"… offene Daten und zählen somit zu den kommunalen Vorreitern. Doch die Anzahl der Kommunen, 
die offene Daten … Ziel der Umfrage war es, bundesweit und umfassend Einschätzungen …"
MM Dapp,2016,Open Data: the benefits; das volkswirtschaftliche Potential für Deutschland; eine Studie im Auftrag der Konrad-Adenauer-Stiftung e. V.,MM Dapp - 2016 - trendreport.de,"… -Charta zufriedenstellend ist und die erhofften open-Data-… Beitrag dazu leisten, open Data 
als gesellschaftliches Thema … der Umfrage wurden fragen nach der aktuellen Nutzung von …"
MD nach Fachgebieten,2023,Fachgruppe Klinische Psychologie und Psychotherapie,Psychologische Rundschau,"… Wir schätzen die im Positionspapier Berufungsverfahren zusammengefassten Vorschläge 
… auf Aspekte von Open Science. Wir unterstützen alle Bemühungen, durch Open Science die …"
M Kloe,2021,"Open Data im sportwissenschaftlichen Anwendungsfeld motorischer Tests: Theoretische, methodische und praxisbezogene Aspekte",M Kloe - 2021 - publikationen.bibliothek.kit.edu,"… Die vorliegende Arbeit möchte einen Beitrag zur Etablierung von Open-Data-Methoden 
im sportwissenschaftlichen Anwendungsfeld motorischer Tests leisten und mit dem …"
"J von Lucke, K Gollasch",2022,Offene Daten und offene Verwaltungsdaten–Öffnung von Datenbeständen,Open Government: Offenes Regierungs-und …,"… durch Open Data zu stärken und Open-Data-Startups global zu vernetzen, wurde 2012 in 
London das Open Data … werden, die bereits als offene Daten in öffentlich zugänglichen Netzen …"
S Nagel,2023,Forschungsinformationssysteme im Kontext von Open Science,S Nagel - 2023 - tubaf.qucosa.de,"… Die wachsende Bedeutung solcher Systeme wird auch durch die Open-Science-Bewegung 
vorangetrieben, die darauf abzielt, die Prinzipien der Offenheit auf den gesamten …"
H Pampel,2017,"ORCID DE–Autorenidentifikation, Publikationsmanagement und Open Science",H Pampel - 2017 - gfzpublic.gfz-potsdam.de,"… • Verzahnung mit weiteren Standards • Förderung des ORCID Deutschland Konsortium • 
ORCID als zentraler Standard für offene Informationsinfrastrukturen für Open Science …"
K Rother,2016,Potenziale von Linked Open Data in Öffentlichen Bibliotheken,K Rother - 2016 - serwiss.bib.hs-hannover.de,"… Eine erneute Umfrage soll aktuell die Veränderungen des vergangenen Jahres ermitteln.Ein 
konkretes Projekt, das sich bei OCLC in der Entwicklung befindet, ist der Library …"
"F König, D Wessel, M Heine",2021,Open Data Hackathon–Vergleich von in Präsenz und online durchgeführten Projektseminaren,HMD Praxis der …,"… Von den neun Teilnehmern der Lehrveranstaltung haben sechs an der Online-Umfrage … 
drei Gruppen des Hackathons in der Umfrage vertreten. Die Umfrage wurde knapp zwei Monate …"
AK Weilenmann,2017,"Open Science ja, aber... Das Zögern der Wissenschaft zur Öffnung: Bericht zur Open Science Conference 2017",Information-Wissenschaft & Praxis,"… „OER-Info“ [17] und „OER meets OPEN Science“. [18] Vorgestellt wurde ebenfalls die Umfrage 
zu „Open Science in Higher Education“, [19] die aufschlussreiche Zahlen zur Bekanntheit …"
"K Söllner, S Wiederkehr",2018,"Taten statt Worte: Bibliotheken gestalten Open Science 47th LIBER Conference, 4.–6. Juli 2018 in Lille",ABI Technik,"… Dabei stützte sie sich auf ihr bereits an anderer Stelle entwickeltes dreidimensionales Modell 
von Open Science, gemäß dem die Transparenz die dritte Dimension neben Partizipation …"
"W Both, I Schieferdecker",2012,Berliner Open Data-Strategie,… Daten in Berlin. Fraunhofer FOKUS im …,"… In dieser Empfehlung werden zum einen ausgewählte Open Data-Prinzipien für die lokalen … 
Bremer Empfehlung enthält mehrere neue Ergänzungen zu den existierenden Open Data-…"
"M Neufend, M Kindling",2021,Von Open Access zu Open Science und wieder zurück? Bericht über den Stand der Open-Access-Transformation im Rückblick auf die Open-Access-Tage …,ABI Technik,"… “(InnOAccess) 24 hat eine Umfrage zur Lage von verlagsunabhängigen, gebührenfreien … 
22 AmeliCA „is a communication infrastructure for scholarly publishing and open science. …"
R Depping,2022,Open Science und Open Access im Aufwind,R Depping - 2022 - kups.ub.uni-koeln.de,"… So hat hier – ohne jede Übertreibung – der Einsatz von Open Science zahlreiche Leben 
gerettet und dazu beigetragen, dass die wirtschaftlichen und sozialen Folgen dieser Pandemie …"
T Gerdes,2018,Die Open-Science-Bewegung und ihre Bedeutung für die wissenschaftlichen Bibliotheken,T Gerdes - 2018 - edoc.hu-berlin.de,"… den Aussagen zum Thema Open Science in für … Open Science aktiv sind. Schließlich ist 
es Ziel dieser Untersuchung, Möglichkeiten für die weitere Entwicklung von Open Science in …"
P Zumstein,2012,Die Rolle des Semantic Web für Bibliotheken: Linked Open Data und mehr: Welche Strategien können hier die Bibliotheken in die Zukunft führen?,Perspektive Bibliothek,"… Open Data kommt hauptsächlich die Veröffentlichung unter einer offenen Lizenz hinzu.Die 
Abgrenzung zwischen Semantic Web und Linked Open Data … , dass Linked Open Data eher …"
T Gerdes,2018,Die Open-Science-Bewegung und ihre Bedeutung für die wissenschaftlichen Bibliotheken: Eine Analyse von Positionspapieren und …,T Gerdes - 2018 - d-nb.info,"… den Aussagen zum Thema Open Science in für … Open Science aktiv sind. Schließlich ist 
es Ziel dieser Untersuchung, Möglichkeiten für die weitere Entwicklung von Open Science in …"
"M Happ, J Wielgosch",2023,Open Data und Open Source für nachhaltige Smart-City-Lösungen. Lagebeschreibung: Smarte Städte und digitale Regionen,"M Happ, J Wielgosch - 2023 - econstor.eu","… Sie zeigen, dass Kommunen zunehmend Offene Daten als Chance sehen – sowohl für die 
eigene Verwaltung als auch für neue Dienstleistungen und Anwendungen von Forschung, …"
W Both,2012,Berlin Open Data-Projektgruppe legt Abschlussbericht vor.,EnviroInfo,"Open Data, die Öffnung der Datenbestände, ist somit kein rein technischer Prozess. Er 
beinhaltet viele rechtliche und organisatorische Belange, trifft auf unterschiedliche …"
MM Dapp,2016,Open data,"Open Data: Dapp, Marcus M.","… onlineUmfrage gestartet. Kontaktiert wurden 24 Kommunen, die über ein eigenes funktionierendes open-Data… Neben der Erhebung von quantitativen Daten mittels der Umfrage wurden …"
"T Klages, A Wuchner",2017,Open Science bei Fraunhofer–Serviceentwicklung und Realisierung einer Forschungsdateninfrastruktur für Open Data,Tage 2017,"… In diesem Kontext ist Open Science ein wichtiges Schlagwort, da es inzwischen möglich 
ist, den gesamten Wissenschaftsprozess von der ersten Idee bis hin zur Veröffentlichung der …"
V Conradt,,Linked Open Data und Semantic Web. Vortragsfolien vom Kongress BIS Konstanz am 14.09. 2012,swop.bsz-bw.de,"Open Data / Linked Open Data … • Open Data und Linked Open Data erhöhen wesentlich 
die Sichtbarkeit von Bibliotheken und Bibliotheksbeständen. • Linked Open Data unter der …"
"JR Sparfeldt, T Richter, V Kubik",2022,Fachgruppe Pädagogische Psychologie. Gute Forschung–bereits im Psychologiestudium!,Psychologische …,"… sind die in der Umfrage angesprochenen … Open Science vermutlich nicht die alleinige „Wunderwaffe“ 
auf dem Weg zu besserer Forschung sein dürfte, explizieren die im Open Science-…"
A Pohl,2014,Bibliotheken: Wir öffnen Daten. Zum Stand der Entwicklung einer offenen Dateninfrastruktur,o-bib. Das offene Bibliotheksjournal,"… This paper tries to put these activities in a bigger context by viewing open data as one 
element of an open data infrastructure. Seven elements of data infrastuctures are outlined and …"
M Jeske,2023,"Herausforderungen im Umgang mit amtlichen Geodaten in Bibliotheken: Open Data, Abgabeerlasse, Geometadaten und Langzeitverfügbarkeit",M Jeske - 2023 - opus4.kobv.de,"… Wie die Antworten der Umfrage zeigen, ist eine große … meine ich insbesondere den Umgang 
mit Open Data, mit … des öffentlichen Sektors 2019 vereinbart wurde (Stichworte: Open Data …"
"K Buschmann, S Kasberger, P Kraker",2015,Open Science in Österreich: Ansätze und Status: Open Science in Austria: Approaches and status,… -wissenschaft & praxis,"… Foundation substantially contributes to Open Science practice- and awareness building … Open Science projects and initiatives, and gives a potential overview of Austria’s Open Science …"
"B Estermann, A Gschwend, S Haller",2020,Basisregister und kontrollierte Vokabulare als Wegbereiter für Linked Open Data in der Schweiz,"B Estermann, A Gschwend, S Haller… - 2020 - arbor.bfh.ch","… durchgeführt, welche sich bereits heute im Linked-Open-Data-Bereich engagieren. Dabei 
enthielt der Leitfaden nicht nur Fragen bezüglich der zu priorisierenden Datenbestände …"
J Fournier,2015,Open Access und Open Data. Positionen und Perspektiven der Deutschen Forschungsgemeinschaft (DFG),Archäologische Informationen,"… Der Beitrag zeigt auf, wie sich die konkreten Formen der Unterstützung von Open Access 
und Open Data durch die DFG aus einigen wenigen Prinzipien erklären lassen, die für das …"
Y Elixmann,2020,Adoption oder Ablehnung? Innovationsentscheidungsprozesse hinsichtlich Open Data in der öffentlichen Verwaltung-Ergebnisse einer explorativen Expert …,Y Elixmann - 2020 - media.suub.uni-bremen.de,"… danach, warum die Ausbreitung von Open Data in Deutschland trotz potenzieller Vorteile … 
Akzeptanz und damit Ausbreitung der Idee von Open Data erfolgen, bzw. gefördert werden …"
A Dreßen,2018,Open Access und Open Data–Wo stehen wir?,Bibliothek Forschung und Praxis,"… , die in Anlehnung an die Berliner Erklärung besagen, dass Forschungsdaten offen 
zugänglich gemacht werden und langzeitarchiviert werden sollten, also als Open Data im Netz …"
K Tochtermann,2018,GO FAIR-Eine Initiative zum fairen Umgang mit Forschungsdaten,K Tochtermann - 2018 - opus4.kobv.de,"… einen geeigneten Wegbereiter für die European Open Science Cloud und ein Internet of fair Data and Services an. In einem gemeinsamen Positionspapier wird die Absicht erklärt, ein …"
D Schäffer,,Open Source und offene Wissenschaft,transcript-open.de,"… -Bewegung – von Open Source über Open Data bis hin zu Open Educational Ressources 
… Seit Mitte der 2010er Jahre drängen zudem Bereiche wie Open Data in die Diskussion, die …"
LM Ferguson,2021,Gute wissenschaftliche Praxis und Open-Science-Publizieren: Worauf Wissenschaftler: innen achten sollten,CampusSource Herbsttagung 2021,"… Open Science dient somit immer auch der Verbesserung der guten wissenschaftlichen Praxis. 
Darüber hinaus fördert Open Science den Wissenstransfer in Gesellschaft, Wirtschaft und …"
"LM Ferguson, H Pampel, C Bruch, R Bertelmann",2020,Gute (digitale) wissenschaftliche Praxis und Open Science: Support und Best Practices zur Umsetzung des DFG-Kodex „Leitlinien zur Sicherung guter …,"LM Ferguson, H Pampel, C Bruch, R Bertelmann… - 2020 - gfzpublic.gfz-potsdam.de","… Open-Science-Praktiken. Es wird praxisnah aufgezeigt, was in Bezug auf das Thema Open Science bei … Einzelne Leitlinien aus dem DFG-Kodex, bei denen ein starker Open-Science-…"
G Sommer,2018,Herausforderungen und Chancen einer offenen digitalen Dateninfrastruktur im Tourismus: Ergebnisse des ersten Think Tanks zu Open Data im Tourismus und …,G Sommer - 2018 - opus4.kobv.de,"… Wenn wir unseren digitalen Assistenten dann nach einer Empfehlung für eine Freizeitaktivität 
am nächsten Tag in der Umgebung fragen, sind die Antworten von Alexa (Amazon), Siri (…"
M Kloe,,Open Data im sportwissenschaftlichen Anwendungsfeld motorischer Tests,d-nb.info,"… Von den 143 teilnehmenden Personen der Umfrage zeigten sowohl Motoriktestanwender*… 
Es lässt sich zusammenfassend sagen, dass Open Data bei der untersuchten Stichprobe …"
"A Orth, B Schmidt",2015,Open Science lernen und lehren: FOSTER Portal stellt Materialien und Kurse bereit: Open Science Education: Learning and Teaching Materials via the FOSTER …,Information-Wissenschaft & Praxis,"… and consolidating Open Science materials and courses, to … navigated either by an Open Science taxonomy or via specific … Bedarf an einem zusätzlichen Leitfaden für die praktische …"
G Forschung–bereits im,2022,Fachgruppe Pädagogische Psychologie,Psychologische …,"… die in der Umfrage angesprochenen For… Open Science vermutlich nicht die alleinige „Wunderwaffe“ 
auf dem Weg zu besserer Forschung sein dürfte, explizieren die im Open Science-…"
"A Kretzschmar, I Thielmann",2022,"Fachgruppe Differentielle Psychologie, Persönlichkeitspsychologie und Psychologische Diagnostik. Ein Kulturwandel ist nur möglich mit den …",Psychologische …,"… und die Umsetzung von Open Science Praktiken kompetenter … in der praktischen Umsetzung 
von Open Science leisten. So … , die Replikationskrise und Open Science Praktiken in den …"
"NL Weisweiler, R Bertelmann, C Bruch, LM Ferguson",2021,Helmholtz Open Science Briefing: Helmholtz in der Nationalen Forschungsdateninfrastruktur (NFDI): Report des Helmholtz Open Science Forums,"NL Weisweiler, R Bertelmann, C Bruch, LM Ferguson… - 2021 - gfzpublic.gfz-potsdam.de","… Aus diesem Grund sieht sich das Helmholtz Open Science Office in einer geeigneten 
Position, um das Thema aufzugreifen, in die Gemeinschaft hineinzutragen und die gemeinsame …"
"P Malczewski, P Korte",2023,Open Data im internationalen Vergleich,VM Verwaltung & …,"… Open-Data-Portale für die Öffentlichkeit bereit.Zwar hat einerseits die Zahl der Open-Data-… 
von Open Data unterschiedlich vorangeschritten ist und überwiegend zögerlich verläuft.…"
"H Pampel, LM Ferguson, R Messerschmidt, K Faensen",2020,Indikatoren für Open Science: Diskussionspapier des Helmholtz Open Science Office,"H Pampel, LM Ferguson, R Messerschmidt, K Faensen - 2020 - gfzpublic.gfz-potsdam.de","… mit Blick auf Empfehlung 1 noch immer die Marke eines Journals oder gar deren Impact … 
genutzt, oder es werden entgegen Empfehlung 4 wenig transparente Datenbanken wie …"
K Mayrhuber,2021,Open Data für smarte und nachhaltige Stadtentwicklung,K Mayrhuber - 2021 - scholar.archive.org,"… for a targeted integration of Open Data in smart and … open data, smart city, and sustainability 
concepts. Research showed that the transparency and openness aimed at with Open Data, …"
SE Schulz,2014,Open Data und staatliches Arcanum,SE Schulz - 2014 - core.ac.uk,"… Sie enthält unter anderem die Empfehlung, sich bundesweit an dieser Regelung zu orientieren 
und die Informationszugangsgesetze als Anknüpfungspunkt für Open Government Data …"
"S Dickel, M Franzen",2015,Digitale Inklusion: Zur sozialen Öffnung des Wissenschaftssystems/digital inclusion: the social implications of open science,Zeitschrift für Soziologie,"Aus dem Blickwinkel der Systemtheorie gilt die Wissenschaft prototypisch als ein 
selbstreferentielles Funktionssystem, das eine soziale Distanz zur Öffentlichkeit unterhält. In der …"
"M Bühner, AL Schubert, C Bermeitinger",2022,DGPs-Vorstand. Der Kulturwandel in unserer Forschung muss in der Ausbildung unserer Studierenden beginnen,Psychologische …,"… Aus den Ergebnissen der Umfrage lässt sich weiterhin ableiten, dass die Studierenden 
dieses Wissen nicht nur passiv rezipieren, sondern auch aktiv in eigenen Forschungsprojekten …"
